<?xml version="1.0" encoding="UTF-8"?>

<autok xmlns:xsi="http://www.w3.org/2001/XMLSchema-instance"
xsi:noNamespaceSchemaLocation="XMLSchemaUJTWLL.xsd">
	<auto rendszam="LFJ873">
		<ar>3000000</ar>
		<kgfb>87736587</kgfb>
		<tulaj szigszam="893456TA">
			<nev>
				<veznev>Tóth</veznev>
				<kernev>László</kernev>
			</nev>
			<nem>Férfi</nem>
		</tulaj>
		<garazs cim="3525 Miskolc Arany János utca 6">
			<garazstulaj>Kiss János</garazstulaj>
			<anyag>Fa</anyag>
			<bizt>Nem</bizt>
		</garazs>
		<karosszeria alvazszam="82733649">
			<fenyezes>Matt</fenyezes>
			<szin>Vörös</szin>
			<szin>Fekete</szin>
		</karosszeria>
		<motor motorszam="23347547">
			<motorkod>MR70</motorkod>
			<loero>150</loero>
			<nyomatek>300</nyomatek>
		</motor>
	</auto>
	<auto rendszam="LFJ873">
		<ar>3000000</ar>
		<kgfb>87736587</kgfb>
		<casco>66234891</casco>
		<tulaj szigszam="893456TA">
			<nev>
				<veznev>Tóth</veznev>
				<kernev>László</kernev>
			</nev>
			<nem>Férfi</nem>
		</tulaj>
		<garazs cim="3433 Nyékládháza Fő utca 23">
			<garazstulaj>Szabó Margit</garazstulaj>
			<anyag>Beton</anyag>
			<bizt>Nem</bizt>
		</garazs>
		<karosszeria alvazszam="82733649">
			<fenyezes>Matt</fenyezes>
			<szin>Vörös</szin>
			<szin>Fekete</szin>
			<matrica>Lángnyelv</matrica>
		</karosszeria>
		<motor motorszam="23347547">
			<motorkod>MR70</motorkod>
			<loero>150</loero>
			<nyomatek>300</nyomatek>
		</motor>
	</auto>
</autok>